Title,Source,Description,Published At,Sentiment,Sentiment Score,Risk Analysis,Risk Score,Risk Detected,Risk Level,Combined Analysis
Coffee’s Grip on America,The Atlantic,Inflation hardly hampered Americans’ love of buying the beverage.,2025-01-03T22:56:00Z,neutral,0.5333521962165833,"The provided text appears to be an excerpt from a newsletter and does not contain information relevant to supply chain risks. As such, it lacks context regarding supply chain operations, disruptions, or risk factors. Therefore, I cannot assess any supply chain risks based on this text.

**Risk Score: 0.0** (No supply chain risks identified)",0.5,True,Medium,Low Risk - Neutral Sentiment
"A palm oil company, a group of US financiers, and the destruction of Peru's rainforest",Business Insider,"A company backed by US financiers sold ""deforestation-free"" palm oil to the makers of Cheetos, Colgate and Pepsi. But its investors have ties to the company that cleared Amazonian rainforest for plantations.",2024-12-31T09:07:01Z,neutral,0.989966630935669,"To effectively assess the supply chain risks associated with the given text regarding palm oil plantations in Peru, we would consider several key factors:

1. **Geographic Location**: The plantations are located near the Ucayali River, which flows from the Andes to the Amazon. This positioning may expose the supply chain to environmental risks, such as flooding, landslides, or other natural disasters that could disrupt operations.

2. **Environmental Impact**: The palm oil industry is often linked to deforestation",0.5,True,Medium,Moderate Risk - Negative Sentiment
Coffee’s Rally Forces Traders to Seek Alternative Hedging Plans,Yahoo Entertainment,"(Bloomberg) -- Coffee prices have been on a tear and for the traders who buy, sell and ship beans around the world this means navigating additional risks...",2024-12-24T10:01:19Z,neutral,0.9966447353363037,"To assess the supply chain risks mentioned in the text, we can break down the key components:

1. **Rising Coffee Prices**: This indicates volatility in the market, which can lead to financial strain on traders and increase costs throughout the supply chain.

2. **Additional Risks**: The mention of ""navigating additional risks"" suggests that existing risks may be compounded, potentially due to factors such as geopolitical issues, weather conditions affecting coffee production, or changes in consumer demand.

3. **",0.5,True,Medium,Moderate Risk - Negative Sentiment
10 Weekend Reads,Ritholtz.com,"The weekend is here! Pour yourself a mug of Colombia Tolima Los Brasiles Peaberry Organic coffee, grab a seat outside, and get ready for our longer-form weekend reads: • AI Wants More Data. More Chips. More Real Estate. More Power. More Water. More Everything…",2025-01-04T11:30:05Z,contradiction,0.5283610820770264,"To assess the supply chain risks in the provided text excerpt, we will analyze various factors mentioned in the context of increased demand due to artificial intelligence (AI). Here’s a breakdown of potential risks and the overall risk score:

### Potential Risks Identified:

1. **Increased Demand for Chips**:
   - **Risk**: The semiconductor industry is already facing capacity constraints. A sudden surge in demand for chips due to AI could exacerbate shortages and lead to delays in production across various sectors, including",0.5,True,Medium,Low Risk - Neutral Sentiment
10 Weekend Reads,Ritholtz.com,"The weekend is here! Pour yourself a mug of Colombia Tolima Los Brasiles Peaberry Organic coffee, grab a seat outside, and get ready for our longer-form weekend reads: • Tracking Putin’s Most Feared Secret Agency—From Inside a Russian Prison and Beyond: The s…",2024-12-28T11:30:32Z,neutral,0.93526691198349,"To assess the supply chain risks based on the provided text, we need to consider the implications of geopolitical tensions, particularly those involving Russia and its internal agencies. Here are some factors to consider:

1. **Geopolitical Instability**: The mention of Putin's secret agency and internal repression indicates a volatile political environment. This can lead to unpredictable actions that may disrupt supply chains, especially for companies operating in or relying on goods from Russia.

2. **Operational Risks**: The reference to a spy",0.5,True,Medium,Moderate Risk - Negative Sentiment
How Christmas is celebrated in 21 places around the world,Business Insider,People around the world celebrate Christmas in their own ways. Here are some photos that show what the holiday looks like in different countries.,2024-12-17T17:08:05Z,neutral,0.934695839881897,"The provided text appears to focus on the cultural aspects of Christmas celebrations, particularly the use of lights, but does not contain specific information about supply chain factors, challenges, or risks. To assess supply chain risks, relevant details such as supply chain disruptions, sourcing issues, logistics challenges, or any other relevant operational considerations would be needed.

Given the absence of such information in the text, the risk score for supply chain risks, based on the content provided, would be:

**Risk Score: 0.",0.5,True,Medium,Moderate Risk - Negative Sentiment
"Everything You Should Order At NYC’s New Vietnamese Bakery, La La Bakeshop",Food52.com,"As a part of our Snack Shop series, Annie Arriaga investigates the latest and greatest viral snack shops in New York City to see if the hype is real, if the snacks are yummy, and if the spot is underrated, overrated, or perfectly rated.
 
 Not every new pop-u…",2025-01-04T06:00:00Z,neutral,0.9614486694335938,"To assess the provided text for supply chain risks, we need to consider several factors related to the supply chain context, such as sourcing, logistics, consumer demand, and market conditions. However, the text provided seems to focus primarily on a review or investigation of snack shops and does not contain specific details about supply chain operations, sourcing of ingredients, distribution channels, or any potential risks associated with those elements.

Since there are no explicit references to supply chain issues, risks related to sourcing, logistics, or other",0.5,True,Medium,Moderate Risk - Negative Sentiment
"Prices, EUDR and Value Inequity Defined the Year in Green Coffee",Dailycoffeenews.com,Sustained relatively high prices and the looming enforcement of the European deforestation-free law known as EUDR captured headlines throughout the green coffee world this year. We say “relatively” high prices...,2024-12-30T16:05:43Z,entailment,0.568231999874115,"To assess the supply chain risks presented in the text regarding the European deforestation-free law (EUDR) and sustained high prices in the green coffee sector, we will consider several factors:

1. **Regulatory Risk**: The enforcement of the EUDR introduces a significant regulatory challenge for businesses involved in the green coffee supply chain. Companies must ensure that their sourcing practices comply with the new regulations, which can require adjustments to supply chain processes. Failure to comply could lead to fines, loss of",0.5,True,Medium,Low Risk - Neutral Sentiment
"Wrong, NBC News, Climate Change Isn’t Causing Rising Coffee Prices, Production Is Increasing",Wattsupwiththat.com,NBC’s portrayal of climate change as a primary driver of rising coffee prices reflects a bias by the media outlet toward blaming nearly every bad thing that occurs on climate change. NBC wrongly aggregates short-term weather events and long-term climate trend…,2024-12-18T02:00:00Z,neutral,0.9294667840003967,"To assess the supply chain risks associated with the information provided in the text regarding climate change and its impact on coffee prices, we can consider several factors:

1. **Climate Change Impact**: The assertion that climate change is affecting coffee production indicates a direct risk to the supply chain. Adverse weather conditions such as droughts, floods, or changing temperature patterns can lead to reduced yields and quality of coffee crops.

2. **Price Volatility**: The mention of rising coffee prices suggests that the supply",0.5,True,Medium,Moderate Risk - Negative Sentiment
Bob Dylan and Joan Baez's real-life relationship was short-lived and tumultuous — but inspired some of their best music,Business Insider,"Bob Dylan and Joan Baez are portrayed by Timothée Chalamet and Monica Barbaro in ""A Complete Unknown."" The two folk singers met in the early '60s.",2024-12-26T12:04:01Z,contradiction,0.6292978525161743,"The provided text appears to be a snippet of information related to a cultural event (a civil rights rally) and references notable musicians (Joan Baez and Bob Dylan). There is no direct mention of supply chain activities, logistics, or any factors that typically contribute to supply chain risks, such as disruptions, delays, supplier issues, or external threats.

Since the text does not provide any relevant information related to supply chain risks, I would assign a risk score of **0**. This indicates that there",0.5,True,Medium,Low Risk - Neutral Sentiment
How To Sample The World’s Most Expensive And Exotic Coffees,Forbes,Coffee beans processed by partial digestion in animals are among the world's rarest. Here’s an exclusive look at the world’s most expensive and exotic coffees.,2024-12-31T11:00:00Z,neutral,0.9846062660217285,"To assess the supply chain risks associated with ""exotic coffee,"" we need to consider several factors typically affecting such products, even though the provided text is limited and lacks specific details. Here are some potential risks associated with the supply chain for exotic coffee:

1. **Geographic Dependency**: Exotic coffee often comes from specific regions (e.g., Andes, Ethiopia). Natural disasters, political instability, or climate change in these areas can disrupt supply.

2. **Quality Variability**: The quality of",0.5,True,Medium,Moderate Risk - Negative Sentiment
Weekly Coffee News: Vietnam Report + Taco Bell’s Cafe Concept,Dailycoffeenews.com,"Roast Magazine’s Daily Coffee News is proud to maintain advertising partnerships with many of the world’s leading coffee companies, yet maintains a focus on fair and objective editorial content, with no sponsored content or native advertising.",2024-12-13T15:01:29Z,contradiction,0.7356817126274109,"To assess the provided text for supply chain risks, we need to consider the context and implications of the content presented:

1. **Market Insights**: The mention of ""USDA Releases Vietnam Coffee"" suggests that there may be important updates or changes related to coffee production in Vietnam, a key player in the global coffee supply chain. If the USDA report includes adverse information—such as crop failures, disease outbreaks, or trade restrictions—it could significantly impact supply levels and prices.

2. **Industry News**",0.5,True,Medium,Moderate Risk - Negative Sentiment
Timeless Luxury On The Mekong River With Heritage Line Cruises,Forbes,"Exploring Vietnam, Laos and Cambodia from the Mekong River allows an unhurried view of life on one of the world’s most important waterways.",2024-12-14T21:53:29Z,neutral,0.9789955019950867,"To assess the supply chain risks based on the provided text, we need to identify potential vulnerabilities or threats that could impact the supply chain of The Jahan cruise service on the Mekong River. However, the text seems to be more of a descriptive piece about the cruise experience rather than a detailed analysis of supply chain components.

Here are some potential supply chain risks that could be relevant, although they are not explicitly mentioned in the text:

1. **Operational Risks**: Disruptions in cruise operations due",0.5,True,Medium,Moderate Risk - Negative Sentiment
Ménard Dworkind combines bold yellows with muted tones in Montreal restaurant,Dezeen,Local studio Ménard Dworkind has outfitted an irregularly shaped Vietnamese restaurant interior with blue and white mosaic tile and yellow accents in Montreal. Le Red Tiger is in a slanted storefront in Montreal's Shop Angus district– the restaurant's second …,2024-12-29T18:00:57Z,neutral,0.8265945315361023,"To assess the supply chain risks associated with the information provided in the text, I will consider several factors including sourcing of materials, logistical challenges, and potential disruptions.

1. **Sourcing of Materials**: The mention of ""blue and white mosaic tile"" and ""yellow accents"" suggests that specific materials are being used for the restaurant's interior design. If these materials are sourced from overseas, particularly from regions with political instability or trade restrictions, this could pose a risk. 

2. **Logistical",0.5,True,Medium,Moderate Risk - Negative Sentiment
Classic Cocktails,A Beautiful Mess,"Classic Cocktails are defined as recipes that have withstood the test of time. Many of these are historic recipes, while some are from more recent decades. Classic cocktails are definitive recipes that you can order at pretty much any bar in the world. In sho…",2024-12-31T13:47:51Z,neutral,0.7830740809440613,"The provided text does not contain any specific information regarding supply chain risks related to classic cocktails, their ingredients, sourcing, or distribution. To accurately assess supply chain risks, I would need information on aspects such as:

1. **Sourcing of Ingredients**: Are there potential shortages or disruptions in the supply of key ingredients for these cocktails (e.g., spirits, bitters, garnishes)?
  
2. **Supplier Stability**: Are the suppliers reliable and stable? Are there risks of them going out of",0.5,True,Medium,Moderate Risk - Negative Sentiment
Coffee prices are higher than ever. Here's what it means for your cup,NPR,Droughts in top coffee-growing countries have shrunk the supply of beans. Supermarket brands like Nescafé and Folgers have already raised prices — but the world keeps drinking more and more coffee.,2024-12-17T09:29:30Z,neutral,0.8844109773635864,"To assess the supply chain risks presented in the text regarding coffee farmers in Brazil, we need to consider several factors:

1. **Weather Dependency**: The texts mention rain gauges and fluctuations in rainfall, indicating a dependency on weather conditions for coffee production. Inconsistent rainfall can lead to droughts or floods, both of which can severely impact crop yields.

2. **Crop Health**: The reference to coffee trees flowering but failing to produce fruit suggests issues with crop health. This could be due to environmental",0.5,True,Medium,Moderate Risk - Negative Sentiment
Vietnam Lifestyle,Erickimphotography.com,"Everyday, insanely phenomenal coffee at coffee shop, insanely fast WiFi, get a massage and think ,,, do creative work, walk and get dinner, back to hotel and sleep? Sublime simplicity?",2024-12-28T21:46:04Z,neutral,0.45980554819107056,"The provided text appears to describe a personal experience or a lifestyle rather than a specific supply chain context. However, we can infer potential risks related to supply chains based on the elements mentioned:

1. **Coffee Supply Chain**: The mention of ""insanely phenomenal coffee"" implies a reliance on coffee suppliers. Risks could include:
   - Fluctuations in coffee bean prices due to climate change, political instability in coffee-producing regions, or supply chain disruptions.
   - Quality control issues if sourcing",0.5,True,Medium,Low Risk - Neutral Sentiment
Coffee prices hover near record highs on futures market,NPR,Droughts in top-producing Brazil and Vietnam caused the price hikes. Supermarket brands like Nescafé and Folgers have already been raising prices -- but the world can't seem to get enough caffeine.,2024-12-17T09:29:30Z,neutral,0.8940355777740479,"The text highlights specific supply chain risks stemming from droughts in key coffee-producing countries (Brazil and Vietnam), which have led to price increases for major brands like Nescafé and Folgers. Here are the key risks identified:

1. **Weather-Related Risks**: Droughts can severely impact the yield of coffee crops, leading to reduced supply and increased prices. This is a significant risk, especially since Brazil and Vietnam are among the top producers.

2. **Price Volatility**: The",0.5,True,Medium,Moderate Risk - Negative Sentiment
How Kenyan workers who earn $2 a day to grow coffee are being hit by climate change,BBC News,Growers find that the changing climate is having a big impact on the size of their harvests.,2024-12-30T00:51:09Z,neutral,0.5490584969520569,"To provide an accurate assessment of supply chain risks based on the provided text, I would need to analyze specific details such as the types of risks present (e.g., environmental, economic, political, social), the geographical context, and any mention of supply chain vulnerabilities or disruptions. 

However, since the text is incomplete and does not provide enough information, I will outline potential risks based on a typical scenario involving smallholder coffee farmers in a region like Komothai, Kenya:

1. **Environmental Risks",0.5,True,Medium,Low Risk - Neutral Sentiment
Why Culture Enthusiasts Flock To Brazil For New Year’s Celebrations,Forbes,"Each year, more culture enthusiasts are discovering the magic of Brazil's, Reveillon Carneiros an elevated festival redefining how to celebrate the New Year.",2024-12-20T20:05:28Z,neutral,0.9717902541160583,"To assess the text for supply chain risks, we need to identify potential vulnerabilities that could affect the supply chain related to the Réveillon Carneiros festival. However, the text provided does not contain specific information regarding logistical elements, suppliers, or any operational details that would directly indicate supply chain risks. 

Key areas typically analyzed for supply chain risks include:

1. **Supplier Dependence**: Reliance on specific suppliers or vendors for materials and services can create risks if they face disruptions.
2. **",0.5,True,Medium,Moderate Risk - Negative Sentiment
Why the price of coffee has spiked,NPR,The cost of coffee has hovered near record highs on the futures market after droughts in top-producing Brazil and Vietnam. Supermarket brands like Nescafé and Folgers have raised their prices.,2024-12-18T22:25:37Z,neutral,0.9822407364845276,"The text highlights several supply chain risks associated with the coffee market. Here are the key points to consider:

1. **Drought in Major Producing Countries**: The droughts in Brazil and Vietnam, which are top coffee producers, pose a significant risk to supply. Drought can lead to reduced coffee yields, impacting the availability of coffee beans.

2. **Price Increases**: The mention of supermarket brands like Nescafé and Folgers raising their prices indicates a direct response to increased costs",0.5,True,Medium,Moderate Risk - Negative Sentiment
"Coffee Research in 2024 Focused on Climate Change, Quality and Human Health",Dailycoffeenews.com,"The vast multidisciplinary world of coffee-related research expanded on all fronts in 2024, yet much of it can be reasonably assigned to one of three categories: green coffee sustainability in...",2024-12-31T17:48:26Z,neutral,0.9837565422058105,"To assess the supply chain risks presented in the provided text, I will analyze key factors such as sustainability, market trends, and potential disruptions.

1. **Sustainability Focus**: The emphasis on green coffee sustainability indicates a shift in consumer preference towards ethically sourced and environmentally friendly products. While this can drive demand for sustainable practices, it also poses risks if suppliers cannot meet these standards, leading to potential shortages or price increases.

2. **Market Expansion**: The mention of an expanding research landscape suggests",0.5,True,Medium,Moderate Risk - Negative Sentiment
"Beyond Rooms: How Riads, Gers, and Local Spaces Redefine Global Travel",Skift,"Even though these hospitality concepts are age-old, they are bang in the middle of all the major deeper travel trends and fulfill all the modern traveler’s expectations. -Rafat Ali",2024-12-13T13:24:12Z,neutral,0.9951252341270447,"To assess the supply chain risks based on the provided text, we need to analyze any potential indicators of risks that might affect the supply chain. However, the text you provided appears to be more focused on personal travel experiences rather than any specific supply chain context or elements.

Since the text does not contain information about supply chain operations, logistics, suppliers, disruptions, or other relevant factors that typically contribute to supply chain risks, it is challenging to assign a risk score based on the content provided.

**Risk Score",0.5,True,Medium,Moderate Risk - Negative Sentiment
Motorola and OnePlus could learn from each other in 2025,Android Central,"Motorola and OnePlus launched some compelling phones in 2024, but they should look to each other if they want to succeed in 2025.",2024-12-23T14:00:00Z,neutral,0.9928168058395386,"To assess the supply chain risks based on the provided text, I would need more context regarding specific factors such as supplier stability, geopolitical influences, technological dependencies, market dynamics, and other relevant details. However, based on the brief excerpt mentioning Samsung, Google, Motorola, and OnePlus in the high-end smartphone market, I can infer a few potential risks:

1. **Market Competition**: The presence of multiple players like Samsung, Google, Motorola, and OnePlus indicates a competitive market environment. This",0.5,True,Medium,Moderate Risk - Negative Sentiment
The Man Who Unraveled Ethiopia,The American Conservative,"How an international darling became a destructive despot.
The post The Man Who Unraveled Ethiopia appeared first on The American Conservative.",2025-01-05T05:00:00Z,neutral,0.9585136771202087,"To assess the supply chain risks based on the provided text about ""The Abiy Project,"" I need to extract relevant information concerning potential risks related to supply chains. However, the text seems to be a book title and description about political dynamics in Ethiopia rather than a direct reference to a supply chain scenario.

Given that it refers to a political figure and the context of governance, the potential supply chain risks may include:

1. **Political Instability**: Changes in leadership or political unrest can disrupt supply chains",0.5,True,Medium,Moderate Risk - Negative Sentiment
A US ally wants to join BRICS. Why?,RT,Kenyan experts have shared their views on the country’s desire to join the group Read Full Article at RT.com,2025-01-09T12:15:58Z,neutral,0.9617065787315369,"To assess supply chain risks based on the provided text, we need to consider factors such as the geopolitical context, economic stability, logistical challenges, and any potential disruptions that could arise from the situation described. However, the text is about a journalist's work and does not provide specific details about a supply chain or related factors.

Since there are no identifiable risks or relevant supply chain information in the text, I would assign a risk score of **0** (indicating no supply chain risk).",0.5,True,Medium,Moderate Risk - Negative Sentiment
The Climate Crisis Is Also an Inflation Crisis,Project Syndicate,"Discussions about global warming often overlook its economic toll on vulnerable populations and how it deepens inequality, focusing instead on green growth and emissions reductions. But rising costs and climate change are inextricably linked, and this should …",2024-12-30T11:26:52Z,neutral,0.9407529234886169,"The provided text appears to focus primarily on the socio-economic aspects of global warming, particularly its impact on vulnerable populations and inequality, rather than directly addressing supply chain risks. However, we can infer potential risks related to supply chains from the context of climate change and its economic toll. 

### Risk Assessment:

1. **Economic Impact on Vulnerable Populations**: The mention of global warming's economic toll on vulnerable populations suggests potential disruptions in supply chains that serve these communities. If these populations face rising costs",0.5,True,Medium,Moderate Risk - Negative Sentiment
Coffee prices hover near record highs on futures market,Biztoc.com,"Coffee prices hover near record highs on futures market
Droughts in top-producing Brazil and Vietnam caused the price hikes. Supermarket brands like Nescafé and Folgers have already been raising prices — but the world can't seem to get enough caffeine.",2024-12-17T09:40:16Z,neutral,0.9939970970153809,"The text indicates several supply chain risks related to coffee production and pricing:

1. **Droughts in Major Producing Countries**: The mention of droughts in Brazil and Vietnam, which are two of the largest coffee producers, presents a significant risk. Drought conditions can severely impact coffee yields, resulting in lower supply and subsequently higher prices.

2. **Rising Prices**: The fact that coffee prices are near record highs suggests volatility in the market. This can affect not only consumers but also",0.5,True,Medium,Moderate Risk - Negative Sentiment
