Title,Source,Description,Published At,Sentiment,Sentiment Score,Risk Analysis,Risk Score,Risk Detected,Risk Level,Combined Analysis
Canopy House: The Brazilian Jungle Home That Touches the Sky,Homedsgn.com,"Nestled in the heart of a tropical forest in Brazil, surrounded by towering trees and vibrant life, the superb Canopy House rises above the ground.",2025-01-01T21:31:10Z,neutral,0.921295166015625,"To assess the supply chain risks based on the provided text, I will need to consider several factors, including geographical location, environmental conditions, potential disruptions, and any relevant socio-economic factors that might impact the supply chain.

1. **Geographical Location**: The text mentions that the Canopy House is located in a tropical forest in Brazil. This area may be prone to natural disasters such as floods, landslides, or severe weather events, which can disrupt supply chains.

2. **Environmental Conditions",0.5,True,Medium,Moderate Risk - Negative Sentiment
"S. Korea President, Texas Lawsuit Over Abortion Pills, Coffee Prices Soar",NPR,South Korea's parliament impeached President Yoon Suk Yeol for his attempt to impose martial law on the democracy. Texas Attorney General Ken Paxton sued a New York doctor for prescribing abortion medication to a Dallas-area woman.  A drought in Brazil has ca…,2024-12-14T15:21:53Z,contradiction,0.8756148815155029,"The text mentions political instability in South Korea due to the impeachment of President Yoon Suk Yeol, which could lead to supply chain risks such as disruptions in governance, changes in trade policies, or instability in the production environment. Additionally, the reference to a lawsuit in Texas does not directly relate to supply chain risks but highlights ongoing legal and political tensions in the U.S. These factors can contribute to uncertainty in the supply chain, particularly in industries that rely on stable regulatory environments.

Considering these points, I",0.5,True,Medium,Moderate Risk - Negative Sentiment
The Glaring Hypocrisy and Embedded Deceptions of the Global Food Giants,Globalresearch.ca,"Bryce Martinez (18) from Pennsylvania is mounting a legal challenge against major food companies, alleging that their ultra-processed foods (UPFs) led to his development of Type 2 diabetes and fatty liver disease at the age of 16.  
The 11 firms …
The post Th…",2024-12-29T18:19:41Z,neutral,0.9403407573699951,"To assess the text for supply chain risks, we need to consider several factors related to the situation described:

1. **Legal Challenges**: Bryce Martinez's legal challenge against major food companies poses a risk to the companies involved. Legal actions can lead to financial losses, reputational damage, and increased scrutiny from regulators, which may affect supply chain operations.

2. **Regulatory Scrutiny**: The allegation that ultra-processed foods led to health issues may prompt regulatory bodies to investigate or impose new regulations",0.5,True,Medium,Moderate Risk - Negative Sentiment
25 New Coffee Roasters to Support in 2025,Dailycoffeenews.com,"This year, dozens of new facilities dedicated to roasting specialty coffee opened across the United States. While some are led by seasoned industry veterans and others by newcomers, nearly all...",2024-12-30T16:03:08Z,neutral,0.9992527365684509,"To assess the supply chain risks presented in the text, I will analyze the key elements that may contribute to potential vulnerabilities or challenges within the supply chain of the specialty coffee industry. 

1. **New Entrants**: The opening of dozens of new roasting facilities indicates a potentially saturated market. While competition can drive innovation and quality, it also poses risks such as price wars, reduced margins, and operational inefficiencies if new entrants lack experience or adequate capital.

2. **Experience Levels**: The mention",0.5,True,Medium,Moderate Risk - Negative Sentiment
"China, Vietnam and Hong Kong may spring surprises in 2025",Livemint,"Global eyes will turn east for good reason. Under watch will be Hong Kong tycoons, China’s recovery attempt, Chinese business ambitions (and luxury demand) and the impact of Trump’s policies on ‘plus one’ exporter Vietnam.",2024-12-24T09:30:01Z,neutral,0.8521923422813416,"The provided text appears to discuss financial market dynamics and investor behavior but does not contain specific information about supply chain operations, logistics, or related risks. Therefore, it is challenging to directly assess supply chain risks based on this excerpt.

**Assessment of Supply Chain Risks:**
1. **Market Volatility**: The mention of ""China's stock rout"" indicates potential instability in the Chinese market, which could affect global supply chains, especially if Chinese suppliers are involved.
2. **Currency Fluctuations",0.5,True,Medium,Moderate Risk - Negative Sentiment
