Title,Source,Description,Published At,Sentiment,Sentiment Score,Risk Analysis,Risk Score,Risk Detected,Risk Level,Combined Analysis
Kopiko Cappuccino Candy 120g $2.29 + Delivery ($0 with Prime/ $59 Spend) @ Amazon AU,Ozbargain.com.au,"A deliciously addictive treat to enjoy your day
Made of coffee bean extract and creamy milk
Convenient candy squares for anytime enjoyment
Country of Origin: Indonesia",2025-01-06T11:33:21Z,contradiction,0.5311795473098755,"The provided text primarily discusses trademarks and copyright information related to OzBargain, an independent community website. It does not contain specific information regarding supply chain operations, processes, or risks such as supplier reliability, transportation issues, regulatory challenges, or market fluctuations.

Based on this analysis, the text does not present any identifiable supply chain risks. Therefore, I would assign a risk score of **0.0** to the text.",0.5,True,Medium,Low Risk - Neutral Sentiment
"The best coffee concentrates, tested and reviewed",NBC News,"Our coffee experts tested and reviewed more than a dozen coffee and cold brew concentrates. Browse the best options based on preparation, strength, flavor and packaging.",2024-12-19T17:53:19Z,neutral,0.993126630783081,"To assess the supply chain risks associated with coffee concentrates, we can consider several factors:

1. **Source of Raw Materials**: Coffee concentrates are derived from coffee beans, which are often sourced from regions that may be affected by climate change, political instability, or natural disasters. If the supply of coffee beans is disrupted, it could impact the availability of coffee concentrates.

2. **Manufacturing and Processing**: The production of coffee concentrates involves specific processing facilities. Any disruption in these facilities due to labor",0.5,True,Medium,Moderate Risk - Negative Sentiment
The Invisible Tsunami Kids,Substack.com,And how you can help,2024-12-29T08:24:27Z,neutral,0.6926689743995667,"The text provided appears to be a fragment or reference to a historical event (the 2004 Indian Ocean tsunami), and does not contain explicit information about current supply chain risks. However, I can assess potential risks related to natural disasters in general, especially in coastal areas like Sumatra.

**Risk Assessment:**

1. **Natural Disasters**: The coastal region of Sumatra is prone to earthquakes, tsunamis, and other natural disasters. Such events can disrupt supply chains, damage infrastructure,",0.5,True,Medium,Low Risk - Neutral Sentiment
Caffeinated Gifts for the Java Lover on Your List,Theinventory.com,"Commerce Content is independent of Editorial and Advertising, and if you buy something through our posts, we may get a small share of the sale. Click here for more.For coffee enthusiasts and connoisseurs alike, discovering unique and flavorful brews can be an…",2024-12-16T20:20:00Z,neutral,0.9668501019477844,"To assess supply chain risks based on the provided text, we need to consider various factors that could affect the supply chain of premium coffee products. Although the text primarily focuses on the enjoyment of coffee and does not provide specific details about supply chain operations, we can infer some potential risks associated with the coffee supply chain in general.

1. **Supply Source Vulnerability**: Coffee is typically sourced from specific regions (e.g., Latin America, Africa). Any political instability, climate change, or natural disasters in",0.5,True,Medium,Moderate Risk - Negative Sentiment
Weekly Coffee News: Comment on Prices + Sustainability Award Nominations,Dailycoffeenews.com,"Roast Magazine’s Daily Coffee News is proud to maintain advertising partnerships with many of the world’s leading coffee companies, yet maintains a focus on fair and objective editorial content, with no sponsored content or native advertising.",2024-12-20T15:52:56Z,contradiction,0.6128731966018677,"To assess the supply chain risks based on the provided text, we need to analyze the content for potential indicators of risk. However, the text appears to be a promotional or informational snippet related to coffee industry news and career opportunities, without specific details about supply chain factors.

Here are some points to consider for risk assessment:

1. **Industry Mention**: The mention of the coffee industry indicates that any risks could be related to agricultural supply chains, which are often vulnerable to climate change, labor issues, and",0.5,True,Medium,Low Risk - Neutral Sentiment
Husband and wife open dream South Indian cafe in Toronto,blogTO,"In a city like Toronto where chai latte reigns and double-doubles dominate the caffeinated scene, a new South Indian cafe is brewing more than just coffee, it's sharing a story steeped in history.
That tale begins in the 16th century, when Baba Budan, an Ind…",2024-12-29T05:00:52Z,neutral,0.5758440494537354,"To assess the supply chain risks based on the provided text, I will look for potential vulnerabilities related to sourcing, distribution, market competition, and external factors that could impact the cafe's operations.

1. **Sourcing Risks**: The text does not provide specific information about where the cafe sources its ingredients (e.g., coffee beans, spices, milk). If the cafe relies on single-source suppliers or imports specific items from regions prone to geopolitical instability or climate change, this could pose a risk.

2",0.5,True,Medium,Low Risk - Neutral Sentiment
"Volunteers clean up Bali's beach from ""worst"" monsoon-driven trash",Yahoo Entertainment,"Hundreds of volunteers joined a cleanup in Bali, Indonesia, Saturday as monsoon rains brought what an activist described as ""the worst"" waves of plastic...",2025-01-04T08:14:20Z,neutral,0.4495832324028015,"The text describes a situation where monsoon rains have led to an increase in plastic waste on Bali's beaches, prompting a significant volunteer cleanup effort. Here’s an assessment of the potential supply chain risks based on this situation:

1. **Environmental Impact**: The influx of plastic waste can affect local ecosystems, potentially harming marine life and the tourism industry, which is critical to Bali's economy. This could lead to longer-term sustainability issues for local suppliers reliant on tourism.

2. **Tourism Disruption",0.5,True,Medium,Low Risk - Neutral Sentiment
USDA sees world coffee output rise a tad at 174.9 million bags of 60 kg each,BusinessLine,"In India, the seventh largest producer, 2024-25 coffee output is seen slightly higher at 6.2 million bags over previous years 6.06 million bags",2024-12-20T04:21:00Z,neutral,0.9926010966300964,"To assess the supply chain risks based on the provided text, we can identify several key factors that may impact the coffee supply chain:

1. **Rebound in Production**: The rebound in production in Vietnam and Indonesia suggests a positive trend for coffee output, which typically indicates a lower risk for supply disruptions. However, fluctuations in production due to weather, pests, or other agricultural issues could still pose risks.

2. **Rising Consumption**: The mention of rising consumption indicates a growing demand for coffee",0.5,True,Medium,Moderate Risk - Negative Sentiment
Below-Average Rainfall in Brazil Supports Coffee Prices,Biztoc.com,"Barchart Premier: The most comprehensive method for keeping track of all your investments.
FREE 30 Day Trial
- Market Pulse
-
- Options Market Overview
- Unusual Options Activity
- IV Rank and IV Percentile
- Implied vs Realized Vol
- Most Active Options
- Hi…",2024-12-16T17:09:28Z,neutral,0.7921112179756165,"The provided text does not contain any specific information about supply chain risks. It appears to be promotional content related to investment tracking and options market overview, with no references to supply chain dynamics, disruptions, vulnerabilities, or risks associated with logistics, sourcing, demand, or other relevant factors.

Given the lack of pertinent information regarding supply chain risks in the text, the risk score would be:

**Risk Score: 0**",0.5,True,Medium,Moderate Risk - Negative Sentiment
Coffee Prices Slip as Rain in Brazil Eases Drought Concerns,Biztoc.com,"Investment Tools And Research To Help Make You A More Confident And Profitable Trader.
FREE 30 Day Trial
- Market Pulse
-
- Options Market Overview
- Unusual Options Activity
- IV Rank and IV Percentile
- Implied vs Realized Vol
- Most Active Options
- Highes…",2024-12-30T19:28:53Z,neutral,0.984728217124939,"The provided text does not contain sufficient information to assess supply chain risks effectively. It appears to focus on investment tools and trading resources rather than specific supply chain activities, processes, or vulnerabilities. 

Key factors typically considered in supply chain risk assessments include supplier reliability, geopolitical factors, logistics and transportation issues, market demand fluctuations, and resource availability. Since the text lacks any references to these elements or any identifiable risks related to supply chain management, it would receive a low risk score.

**Risk Score: 0",0.5,True,Medium,Moderate Risk - Negative Sentiment
Global food prices are entering very dangerous territory,Naturalnews.com,"What in the world is going to happen if global food supplies continue to get even tighter?  During the second half of this year global food prices have been surging.  A “perfect storm” of factors is suppressing production all over the planet, and meanwhile wo…",2024-12-13T06:00:00Z,neutral,0.992486834526062,"To assess the supply chain risks based on the provided text, we can identify several key factors that would contribute to the overall risk score. Here are the main considerations:

1. **Global Supply Constraints**: The mention of ""global food supplies getting even tighter"" indicates a potential shortage in supply, which can lead to increased competition for resources and higher prices.

2. **Rising Prices**: The statement about food prices surging suggests inflationary pressures that could affect purchasing power and profitability across the supply",0.5,True,Medium,Moderate Risk - Negative Sentiment
"3 Ways To Explore Cartagena, Colombia’s Hub For Caribbean Culture",Forbes,"From world-class hotels to refined restaurants to fascinating museums, the Colombian city of Cartagena truly has it all.",2024-12-15T18:39:27Z,neutral,0.721049427986145,"The provided text primarily discusses Cartagena, Colombia, and does not contain any specific details regarding supply chain operations, logistics issues, or risks associated with the supply chain. Without context related to supply chain disruptions, such as political instability, economic conditions, natural disasters, or logistical challenges specific to Cartagena or Colombia, it is impossible to assess any supply chain risks.

Given the lack of relevant information, I would assign a risk score of 0, indicating no identifiable supply chain risks based on the text provided.",0.5,True,Medium,Moderate Risk - Negative Sentiment
Midwest Brewery Helps Launch 20 Beverage Brands,Forbes,A Chicago and Milwaukee brewing company brews its own beers and helped launch 20 other beverage brands.,2024-12-22T13:00:00Z,neutral,0.8453646302223206,"To assess the supply chain risks associated with Pilot Project Brewing based on the provided text, we need to consider various factors that could impact their operations. However, the text does not provide specific details regarding their supply chain, raw materials, distribution channels, or any external threats.

Given the general context of a craft brewery, some potential supply chain risks to consider could include:

1. **Supplier Reliability**: Craft breweries often rely on specific suppliers for unique ingredients (like hops and malt). If suppliers face disruptions",0.5,True,Medium,Moderate Risk - Negative Sentiment
Are Ultra-Processed Foods Killing Us?,The New Yorker,"Studies have linked them to obesity, diabetes, depression, and even dementia. Dhruv Khullar reports on a revolution in nutrition science that aims to fix America’s deadly diet.",2025-01-06T11:00:00Z,neutral,0.9837625026702881,"To assess the supply chain risks based on the provided text, we would need relevant information about the supply chain context, such as specific disruptions, dependencies, or vulnerabilities related to the individual mentioned or the location. Unfortunately, the excerpt provided does not contain any specific details regarding supply chain operations, risks, or challenges.

Given the lack of context to effectively analyze and derive a risk score, the risk score would be:

**Risk Score: 0.0**

This score reflects the absence of identifiable supply chain",0.5,True,Medium,Moderate Risk - Negative Sentiment
Weathering the Market: Why Climate Data Is the Future of Commodity Trading,Observer,"The global commodity market is more volatile than ever, with weather-driven price swings rivaling those of cryptocurrencies.",2024-12-26T13:00:39Z,neutral,0.9834955334663391,"To assess the supply chain risks presented in the provided text, we need to identify potential risks and factors that could impact supply chain operations:

1. **Climate-Driven Reality**: The mention of adapting to a climate-driven reality indicates that businesses may face risks related to climate change, such as extreme weather events disrupting transportation and production.

2. **Need for Meteorological Thinking**: Suggesting that companies need to ""think like a meteorologist"" implies a need for advanced forecasting techniques. This could indicate",0.5,True,Medium,Moderate Risk - Negative Sentiment
"City Guide: Bologna, Italy According To The Best Tour Guides",Forbes,"From tortellini to the best gelato in town, find out were to eat and drink in Bologna, Italy, according to the the best tour guides.",2024-12-20T20:16:48Z,neutral,0.9991656541824341,"To assess the text for supply chain risks, it's important to consider several factors, including the sourcing of raw materials, production processes, transportation, and potential disruptions.

1. **Ingredient Sourcing**: Tortellini in brodo is a traditional dish that relies on specific ingredients such as pasta, broth, and various fillings. If these ingredients are sourced locally within the Emilia-Romagna region, the risk is lower. However, if any ingredients are sourced from regions prone to agricultural disruptions (like floods",0.5,True,Medium,Moderate Risk - Negative Sentiment
Global Food Prices Are Entering Very Dangerous Territory,Shtfplan.com,"What in the world is going to happen if global food supplies continue to get even tighter?  During the second half of this year, global food prices have been surging.  A “perfect storm” of factors is suppressing production all over the planet, and meanwhile, …",2024-12-13T13:30:36Z,neutral,0.9720265865325928,"To assess supply chain risks based on the provided text, I will focus on the implications of tightening global food supplies. While the full content of the article isn't available, I can make a general assessment based on the themes it likely addresses:

1. **Global Food Supply Tightening**: This indicates a risk of shortages in essential commodities, which can lead to increased prices, scarcity, and potential civil unrest. Such supply disruptions can affect various sectors, from agriculture to retail.

2. **Dependency on Global",0.5,True,Medium,Moderate Risk - Negative Sentiment
"Bolivia, Peru Single Origins, 1kg from $27.90 + Delivery ($0 with $69 Order, $0 C&C, Delayed Disp Avail) @ Lime Blue Coffee",Ozbargain.com.au,"Hey Oz Bargain Community,

Happy New Year!

Keeping this one short and sweet for you to kick off our first Oz Bargain deal post in 2025:)

We're offering you a 40% discount off our deliciously sweet Peru Chanchamayo Grade 1 Organic Single Origin and our super…",2025-01-08T20:08:33Z,neutral,0.9788508415222168,"Based on the provided text, there are insufficient details to accurately assess specific supply chain risks. The text primarily focuses on a promotional deal, which does not provide context regarding production, sourcing, logistics, or potential disruptions. 

However, I can identify some general considerations that could contribute to supply chain risk in a promotional context:

1. **Demand Surge**: A 40% discount may lead to a sudden increase in demand, which could strain supply if inventory levels are not adequate.
2. **Supplier",0.5,True,Medium,Moderate Risk - Negative Sentiment
"Torpedo juice: Legendary, illegal WWII liquor drunk in Alaska and the world",Anchorage Daily News,"Named for the 180-proof ethyl alcohol that powered American torpedoes, the concoction was consumed throughout the Navy and beyond.",2024-12-17T03:28:18Z,neutral,0.8461053967475891,"The text provided does not contain any relevant information regarding supply chain risks. It primarily discusses a historical event involving fighter pilots in Alaska during 1943 and mentions a local historian's work. 

As there are no details related to supply chain operations, vulnerabilities, disruptions, or any potential risks associated with supply chains, I would assign a risk score of 0. 

**Risk Score: 0**",0.5,True,Medium,Moderate Risk - Negative Sentiment
Pony Coffee Gallops Into Tulsa with First Cafe,Dailycoffeenews.com,"A new coffee roasting company called Pony Coffee is showing itself in Tulsa, with its first cafe in a landmark building in Riverview.  The coffee shop that opened in October...",2025-01-09T14:51:57Z,neutral,0.9909007549285889,"To assess the supply chain risks related to the opening of Pony Coffee in Tulsa, we would need to consider various factors such as sourcing of raw materials, distribution logistics, regulatory compliance, local market conditions, and potential disruptions. Based on the limited information provided in the text, here are some key risk factors to consider:

1. **Sourcing of Raw Materials**: The coffee industry is heavily reliant on the availability of quality coffee beans. Any disruptions in sourcing, whether due to climate change, geopolitical issues",0.5,True,Medium,Moderate Risk - Negative Sentiment
My Essential Christmas Dessert Is Flan,Cupofjo.com,"Flan is pure nostalgia for me. My Tex-Mex mom made it often, blending all the milk and eggs in a blender, agonizing over the caramel, and then shrieking if it unmolded with a crack in the center.… Read more 
The post My Essential Christmas Dessert Is Flan app…",2024-12-18T19:41:14Z,neutral,0.5885751247406006,"The provided text appears to be a nostalgic reflection on making flan, a dessert, rather than a detailed description of a supply chain scenario. However, there are a few points that can be considered from a supply chain risk perspective:

1. **Ingredient Sourcing**: If the flan is made from milk and eggs, there could be risks associated with the sourcing of these ingredients, such as price volatility, supplier reliability, and changes in agricultural production due to climate change.

2. **Manufacturing",0.5,True,Medium,Low Risk - Neutral Sentiment
Starbucks debuts Cortados for first time: See 2025 winter drink menu,USA Today,"A cortado is made with a 1:1 ratio of espresso and steamed milk. Starbucks' Cortado is made with ristretto shots, which are more concentrated.",2025-01-02T20:43:25Z,neutral,0.942744255065918,"To assess the supply chain risks based on the provided text, I would consider the following factors:

1. **Product Introduction**: The introduction of a new product (Cortados) can pose risks related to sourcing ingredients, production capacity, and training staff. If the supply chain is not adequately prepared, it could lead to shortages or delays.

2. **Limited-Edition Menu**: Limited-edition items can create spikes in demand that the supply chain may not be able to accommodate. This could",0.5,True,Medium,Moderate Risk - Negative Sentiment
10 New Countries I Hope To Visit In 2025,Liveandletsfly.com,"I fell far short of the goal in 2023 and again in 2024, but I’m setting what I hope will be an achievable goal in 2025: visit 10 countries I have not previously visited… 10 New Countries For 2025 As I focus on the more important matters of my family, cultivat…",2025-01-02T13:23:31Z,neutral,0.8438835144042969,"The provided text does not contain specific information related to supply chain risks. It appears to be a personal statement about travel goals rather than a discussion of supply chain operations, challenges, or vulnerabilities.

To effectively assess supply chain risks, the text would need to address factors such as:

1. **Supplier Reliability**: Information about suppliers' ability to deliver products on time.
2. **Geopolitical Factors**: Insights into how political instability in certain regions might affect supply chains.
3. **Natural Dis",0.5,True,Medium,Moderate Risk - Negative Sentiment
"Indian coffee gains from surging trend in global prices, outlook seen bright",BusinessLine,"Indian coffee sector benefits from global price surge, exports rise, but production challenges persist; sustainability and innovation key for future.",2024-12-30T12:39:49Z,neutral,0.9774865508079529,"To assess the supply chain risks based on the provided text, we can consider several factors:

1. **Dependence on Global Prices**: The Indian coffee sector is significantly influenced by global price surges. While this can lead to increased revenue, it also indicates vulnerability to fluctuations in global markets, which can be risky.

2. **Reliance on Large Producers**: The tight supply from major coffee producers like Brazil suggests a risk of over-reliance. If Brazil or Vietnam faces production issues (",0.5,True,Medium,Moderate Risk - Negative Sentiment
Review: Garuda Indonesia International Lounge Jakarta (CGK),Liveandletsfly.com,"Let me be blunt: the Garudia Indonesia International Lounge in Jakarta (CGK), also called the Executive Lounge, is a sorry excuse for a lounge from a five-star carrier at its main hub of operation. Your best is to visit the nearby Plaza Premium Lounge, also i…",2025-01-06T07:27:41Z,neutral,0.7799553275108337,"To assess supply chain risks based on the provided text, we need to identify potential issues that could impact the supply chain of the airline or its operations at the Jakarta hub. 

1. **Operational Quality**: The text indicates dissatisfaction with the lounge's quality. This could reflect broader operational issues within the airline, such as inadequate service delivery, reduced customer satisfaction, and potential reputational damage, which could affect passenger demand and loyalty.

2. **Customer Experience**: Negative reviews about the lounge can lead",0.5,True,Medium,Moderate Risk - Negative Sentiment
Best of ‘Three Questions’ 2024: Conversations with Coffee Leaders,Dailycoffeenews.com,"Continuing our 2024 Year in Review, here are some highlights from our ongoing “Three Questions With” series, which features people doing amazing work in all corners of the coffee world. ...",2024-12-24T15:01:57Z,contradiction,0.5802028179168701,"To assess the supply chain risks based on the provided text, we would typically look for indicators such as disruptions in sourcing, geopolitical issues, environmental impacts, labor challenges, and logistical concerns. However, the excerpt you provided does not contain specific information about the supply chain, nor does it mention any associated risks. It seems to focus on highlights and features related to individuals in the coffee industry without delving into operational or logistical challenges that would typically raise supply chain risk concerns.

Given the absence of relevant risk factors",0.5,True,Medium,Low Risk - Neutral Sentiment
Individual and community-level determinants of knowledge of obstetric danger signs among women in Southern Ethiopia: A multi-level mixed effect negative binomial analysis,Plos.org,"Introduction One of the key strategies to achieve the sustainable development goal by reducing maternal deaths below 70 per 100,000 is improving knowledge of obstetric danger signs (ODS). However, mothers’ knowledge of ODS is low in general and very low in ru…",2025-01-06T14:00:00Z,neutral,0.9320167303085327,"To effectively assess the supply chain risks based on the provided text, we need to consider several key factors typically associated with supply chain disruptions:

1. **Key Stakeholders**: The mention of sustainable development goals and maternal health implies involvement from various stakeholders, including healthcare providers, policymakers, NGOs, and possibly international organizations. If any stakeholder faces operational challenges or misalignment in objectives, this can cause disruptions.

2. **Information Reliability**: The focus on improving knowledge of obstetric danger signs suggests a reliance",0.5,True,Medium,Moderate Risk - Negative Sentiment
Review: Plaza Premium Lounge Jakarta (CGK),Liveandletsfly.com,"I loved the Plaza Premium Lounge in Jakarta (CGK) Terminal 3, which offers a tranquil environment with a wide selection of food and drink as well as excellent coffee. Plaza Premium Lounge Jakarta Review (CGK) If you are looking for the best lounge at CGK, loo…",2025-01-06T09:18:20Z,neutral,0.46705034375190735,"The provided text primarily expresses a personal opinion about the Plaza Premium Lounge in Jakarta, focusing on its ambiance, food selection, and coffee quality. It does not contain any information related to supply chain operations, logistics, procurement, or any elements that would typically indicate supply chain risks (such as disruptions, delays, supplier reliability, etc.).

Given the lack of relevant supply chain information in the text, the risk score would be:

**Risk Score: 0.0** 

This score reflects that there are",0.5,True,Medium,Low Risk - Neutral Sentiment
